{"schema":"plan/v1","task_id":"teach-quiz-eigenvectors","goal":"Teach the user what eigenvectors are with clear intuition and worked examples, then quiz them to check and reinforce understanding.","nodes":[{"id":"teach-eigenvectors","agent":"teachAS","prompt":"Teach the user what eigenvectors and eigenvalues are, from the ground up, intuition before formula, with a worked 2x2 example.","produces":"eigenvectors-lesson","inputs":[]},{"id":"quiz-eigenvectors","agent":"teachAS","prompt":"Using the lesson, create and run a quiz that checks genuine understanding, with answer key and per-question concept tags.","produces":"eigenvectors-quiz","inputs":["eigenvectors-lesson"],"depends_on":["teach-eigenvectors"]}]}
